{
  "id": "2026-10-22-tw-001",
  "status": "published",
  "model": "claude-sonnet-5-5",
  "created_at": "2026-10-23T00:05:31Z",
  "record_id": "2026-10-22-tw-001",
  "source_kind": "official",
  "published_at": "2026-10-23T00:05:31Z",
  "headline": "台湾の3機関、AIと著作権で初の意見交換会",
  "lead": "台湾のデジタル発展部、文化部、経済部智慧財産局は、2026年10月16日にAIと著作権の意見交換会を初めて共同で開きました。内容産業の代表やAI事業者、専門家が参加し、学習データの利用や著作権保護を話し合いました。発表は10月22日で、新しい義務を定めたものではありません。",
  "facts": [
    {
      "text": "デジタル発展部、文化部、経済部智慧財産局は、10月16日に権利者の意見交換会を初めて共同で開きました。",
      "source_url": "https://moda.gov.tw/press/press-releases/21142"
    },
    {
      "text": "会議には国内の内容産業の代表や業界団体、AI応用側の事業者、専門家が招かれました。",
      "source_url": "https://moda.gov.tw/press/press-releases/21142"
    },
    {
      "text": "議題は、AI学習に必要なデータの利用と許諾、著作権の保護、良質な言語データの整備と産業協力でした。",
      "source_url": "https://moda.gov.tw/press/press-releases/21142"
    },
    {
      "text": "智慧財産局は《生成式人工智慧著作権指引》の草案を、デジタル発展部は《促進資料創新利用發展條例》の草案を、それぞれ作成しています。",
      "source_url": "https://moda.gov.tw/press/press-releases/21142"
    },
    {
      "text": "デジタル発展部は、条例草案でデータの開放・共有・再利用を制度化し、適切な許諾条項を設け、AI事業者による使用報酬の支払い体制づくりを進めると説明しました。",
      "source_url": "https://moda.gov.tw/press/press-releases/21142"
    },
    {
      "text": "3機関は各界の意見をまとめ、関係部署と協力して、今後の政策と法制の方向を慎重に検討するとしています。",
      "source_url": "https://moda.gov.tw/press/press-releases/21142"
    }
  ],
  "who_is_affected": "台湾で生成AIを開発・提供する事業者が、将来の影響を受ける場合があります。台湾の著作物を学習データに使う企業や、台湾の内容産業と取引する企業も該当する場合があります。現時点では、草案が正式に決まったわけではありません。",
  "japan_impact": "日本企業が台湾向けにAIサービスを出す場合、学習データの出所と許諾の記録を整理しておくとよいでしょう。台湾拠点や現地パートナーがある企業は、草案の動きを確認するとよいでしょう。報酬支払いの仕組みが入る可能性は資料に書かれていますが、日本企業に適用されるかは分かりません。",
  "next_steps": "資料に書かれている予定は、3機関が意見をまとめ、政策と法制の方向を検討することです。草案の公表時期や施行日は書かれていません。今後、草案の内容が具体化する可能性があります。これは推測です。日本企業は、公式発表を定期的に確認するとよいでしょう。",
  "unknowns": [
    "両草案の条文内容と、対象となる事業者の範囲",
    "草案の国会提出時期と施行日",
    "違反した場合の罰則の有無",
    "AI事業者による使用報酬の具体的な算定方法や金額",
    "海外事業者への適用の有無"
  ],
  "glossary": [
    {
      "term": "デジタル発展部（moda）",
      "explanation": "台湾のデジタル政策を担当する政府機関です。今回の会議を主催した機関の一つです。"
    },
    {
      "term": "智慧財産局",
      "explanation": "台湾の経済部に属し、知的財産を扱う機関です。著作権の指針案を作成しています。"
    },
    {
      "term": "主権AI訓練語料庫",
      "explanation": "デジタル発展部が2025年末に公開した、繁体字中国語の学習用データ集です。2026年10月中旬までに33億トークンが集まりました。"
    },
    {
      "term": "トークン",
      "explanation": "AIが文章を処理するときの文字や語のまとまりの単位です。"
    }
  ]
}
