{
  "id": "2026-10-01-tw-001",
  "status": "published",
  "model": "claude-sonnet-5-5",
  "created_at": "2026-10-10T11:19:58Z",
  "record_id": "2026-10-01-tw-001",
  "source_kind": "official",
  "published_at": "2026-10-10T11:19:58Z",
  "headline": "台湾デジタル発展部次長、米国でAIガバナンス実践を紹介",
  "lead": "台湾のデジタル発展部（moda）の侯宜秀政務次長が、2026年9月29日に米国で開かれた研討会で講演し、AIの普及と安全な利用の両立に向けた台湾の取り組みを説明しました。「人工智慧基本法」やAIリスク分類枠組みに言及し、理念の近いパートナーとの協力を呼びかけています。新たな規制や企業への義務を定めた発表ではありません。",
  "facts": [
    {
      "text": "侯宜秀政務次長は9月29日、米ニューヨークで開かれた研討会「AI向善：台湾の挑戦と機会」で基調講演を行いました。",
      "source_url": "https://moda.gov.tw/press/press-releases/20734"
    },
    {
      "text": "この研討会は、台北経済文化辦事処（ニューヨーク）と米台商業協会が、2026年の国連総会ハイレベル週間の関連行事として共催しました。",
      "source_url": "https://moda.gov.tw/press/press-releases/20734"
    },
    {
      "text": "次長は、AIの広い普及とAIの安全な利用が各国共通の課題だと述べました。",
      "source_url": "https://moda.gov.tw/press/press-releases/20734"
    },
    {
      "text": "次長は、普及については戦略的自主性を持つ「主権AI」を基盤とし、人材育成や「AI花園」計画で進めると説明しました。",
      "source_url": "https://moda.gov.tw/press/press-releases/20734"
    },
    {
      "text": "次長は、安全性については「人工智慧基本法」やAIリスク分類枠組みなどのガバナンス機構を、各部会や産業と協力して運用すると説明しました。",
      "source_url": "https://moda.gov.tw/press/press-releases/20734"
    },
    {
      "text": "次長はワシントン首都圏でのワークショップでも講演し、政府、企業、市民社会、研究者が共同でAIガバナンスに参加することで主権AIを実現できると述べました。",
      "source_url": "https://moda.gov.tw/press/press-releases/20734"
    }
  ],
  "who_is_affected": "今回の発表は講演の報告であり、特定の企業に義務を課す内容は本文からは読み取れません。そのため、直接の対象は現時点では限定的と考えられます。ただし、台湾でAIを開発・提供する企業や、台湾のサプライチェーンと取引する企業は、台湾政府の政策方向を知る材料になる可能性があります。",
  "japan_impact": "日本企業に直ちに対応が必要になる内容ではないと考えられます。台湾向けにAIサービスを提供する企業や、台湾に拠点・取引先がある企業は、「人工智慧基本法」やリスク分類枠組みの今後の動きを継続的に確認しておくとよいでしょう。なお、ワークショップには日本の専門家も参加したと本文にあります。",
  "next_steps": "資料には、法律の施行日や今後の具体的な手続きの予定は書かれていません。今後は、台湾の「人工智慧基本法」やリスク分類枠組みに関する別の公式発表を確認する必要があります。これらが具体化するかどうかは資料からは分からず、推測もできません。",
  "unknowns": [
    "「人工智慧基本法」の現在の位置づけや内容、施行時期（本文には詳細がない）",
    "AIリスク分類枠組みの具体的な区分や、民間企業への適用の有無",
    "違反時の罰則の有無",
    "今回の講演を受けた追加の政策や規則の予定"
  ],
  "glossary": [
    {
      "term": "主権AI",
      "explanation": "本文では、戦略的自主性を持つ国家のAI能力を指す言葉として使われています。協力的なガバナンスで実現するとされています。"
    },
    {
      "term": "人工智慧基本法",
      "explanation": "台湾のAI基本法です。本文ではAIの安全性と信頼性を確保するガバナンス機構の一つとして言及されています。"
    },
    {
      "term": "AIリスク分類枠組み",
      "explanation": "AIをリスクの観点で分類して管理するための枠組みです。本文には詳細な内容は書かれていません。"
    }
  ]
}
