{
  "id": "2026-09-18-cn-001",
  "status": "published",
  "model": "claude-sonnet-5-5",
  "created_at": "2026-10-10T11:19:58Z",
  "record_id": "2026-09-18-cn-001",
  "source_kind": "official",
  "published_at": "2026-10-10T11:19:58Z",
  "headline": "中国TC260、エージェント開発の安全指南案で意見募集",
  "lead": "中国の全国ネットワーク安全標準化技術委員会（TC260）の事務局は、2026年9月18日付で「エージェントシステム開発安全指南（意見募集稿）」について広く意見を求める通知を出しました。意見の提出期限は2026年10月2日です。今回掲載されているのは通知ページで、指南案の本文は添付PDFとして付いており、この記事の材料には含まれていません。",
  "facts": [
    {
      "text": "TC260事務局は、エージェントシステムの安全な開発を指導し、関連する安全リスクを防ぎ解消することを目的に、「ネットワーク安全標準実践指南——エージェントシステム開発安全指南（意見募集稿）」を作成しました。",
      "source_url": "https://www.tc260.org.cn/tc260/tzgg/202609/e5b82ae7aca244d19d36b39575cbb458.shtml"
    },
    {
      "text": "事務局は、TC260の「ネットワーク安全標準実践指南」文書管理弁法の定めに基づき、この意見募集稿について社会に向けて公開で意見を募ることにしました。",
      "source_url": "https://www.tc260.org.cn/tc260/tzgg/202609/e5b82ae7aca244d19d36b39575cbb458.shtml"
    },
    {
      "text": "意見や提案は、2026年10月2日までに事務局へ送るよう求められています。",
      "source_url": "https://www.tc260.org.cn/tc260/tzgg/202609/e5b82ae7aca244d19d36b39575cbb458.shtml"
    },
    {
      "text": "通知は2026年9月18日付で、文書番号は「網安秘字〔2026〕119号」です。指南案本文は添付PDFとして掲載されています。",
      "source_url": "https://www.tc260.org.cn/tc260/tzgg/202609/e5b82ae7aca244d19d36b39575cbb458.shtml"
    }
  ],
  "who_is_affected": "通知の本文には適用対象が書かれていません。そのため以下は解釈です。中国でAIエージェントを開発・提供する事業者や、開発を委託・支援する企業が、将来この指南を参照する可能性があります。ただし、指南が義務なのか推奨なのかは、この通知からは分かりません。",
  "japan_impact": "日本企業にとっては、中国向けのAIエージェント製品を開発・提供している場合や、中国の拠点・取引先が開発に関わっている場合に関係しうる話です。まず添付PDFの指南案を入手し、開発プロセスのどこに安全面の要求が置かれているかを確認するとよいでしょう。自社の開発体制と照らし合わせる作業の準備も考えられます。意見提出を検討する場合は、期限が2026年10月2日と近い点に注意が必要です。本記事は情報整理であり、法的助言ではありません。",
  "next_steps": "資料に書かれている予定は、2026年10月2日までの意見募集のみです。その後の確定版の公表時期や施行時期は、資料に記載がありません。募集後に内容が修正されて確定していくという見方は推測です。",
  "unknowns": [
    "指南案の具体的な要求事項（添付PDFの内容）",
    "指南の適用対象となる事業者や製品の範囲",
    "確定版の公表時期と実施時期",
    "指南に従わない場合の罰則や法的拘束力の有無",
    "外国企業や海外から中国へ提供するサービスへの適用の有無"
  ],
  "glossary": [
    {
      "term": "TC260（全国ネットワーク安全標準化技術委員会）",
      "explanation": "中国のネットワーク安全分野の標準化を担う技術委員会です。今回の通知は同委員会の事務局が出しました。"
    },
    {
      "term": "ネットワーク安全標準実践指南",
      "explanation": "TC260が作成する文書の種類で、今回の指南案もこれに当たります。拘束力の有無はこの通知からは分かりません。"
    },
    {
      "term": "意見募集稿",
      "explanation": "正式決定の前に、広く意見を求めるために公開される草案です。"
    },
    {
      "term": "エージェントシステム",
      "explanation": "中国語の原文では「智能体系统」で、本記事ではAIエージェントのシステムと理解しています。具体的な定義は通知本文には書かれていません。"
    }
  ]
}
