{
  "id": "2026-10-08-in-001",
  "status": "draft",
  "model": "claude-sonnet-5-5",
  "created_at": "2026-10-10T08:45:28Z",
  "record_id": "2026-10-08-in-001",
  "source_kind": "media",
  "headline": "インドMeitY大臣、AI規制の意見募集文書を1か月内に公表と表明",
  "lead": "インドの電子情報技術省（MeitY）のアシュウィニ・ヴァイシュナウ大臣は2026年10月8日、AI規制に関する意見募集文書を1か月以内に公表する考えを示しました。安全性やディープフェイクなど5つの点に焦点を当てるとしています。文書の正式な公表はまだで、規制の中身も未確定です。",
  "facts": [
    {
      "text": "ヴァイシュナウ大臣は2026年10月8日、世界開発報告2026の発表の場で、AI規制の時期が来たと述べ、省に対して規制を主題とした意見募集文書を作るよう求め、1か月以内に公表すると語りました。",
      "source_url": "https://www.medianama.com/2026/10/223-meity-consultation-paper-ai-regulation/"
    },
    {
      "text": "大臣は文書の柱として、AI利用の安全性、人間第一、スケール（拡大）、誰も取り残さない包摂性、ディープフェイクなど社会への害の5点を挙げました。",
      "source_url": "https://www.medianama.com/2026/10/223-meity-consultation-paper-ai-regulation/"
    },
    {
      "text": "大臣は、AIは法律だけでは規制できないとして技術と法を組み合わせた解決策が必要だと述べ、サイバーセキュリティ、安全性、利用者への害、ディープフェイクなどでは業界が主要な責任を負うべきだと語りました。",
      "source_url": "https://www.medianama.com/2026/10/223-meity-consultation-paper-ai-regulation/"
    },
    {
      "text": "2026年6月にヴァイシュナウ大臣は、AI専用の新法が必要だと考えており、業界と枠組みを協議していると述べました。2026年7月にはMeitY事務次官のS・クリシュナン氏が、関係者との議論を経て起草の過程を始めると述べました。",
      "source_url": "https://www.medianama.com/2026/10/223-meity-consultation-paper-ai-regulation/"
    },
    {
      "text": "2025年11〜12月には、クリシュナン氏が規制を先行させない方針や、新法を避け既存法（DPDP法など）を活用したいという考えを示していました。",
      "source_url": "https://www.medianama.com/2026/10/223-meity-consultation-paper-ai-regulation/"
    },
    {
      "text": "2026年4月に、AI政策を調整する中央の機関としてAIガバナンス・経済グループ（AIGEG）が設置されました。",
      "source_url": "https://www.medianama.com/2026/10/223-meity-consultation-paper-ai-regulation/"
    }
  ],
  "who_is_affected": "現時点では文書が出ていないため、対象は確定していません。インド国内でAIを開発・提供する企業や、インドの利用者向けにAIサービスやコンテンツ生成機能を提供する海外企業が、今後の議論に関係する可能性があります。大臣が業界に主要な責任を求める趣旨の発言をしていることから、ディープフェイクやサイバーセキュリティに関わるサービスは特に注目されると考えられます。",
  "japan_impact": "今回は規制そのものの決定ではなく、意見募集文書の公表予告です。インド向けにAIサービスを提供している、またはインド拠点やインドの取引先がある日本企業は、文書が出た際に内容を確認し、必要に応じて意見提出を検討するとよいでしょう。事前の準備としては、自社AIのインドでの提供状況、ディープフェイクや安全性に関する自社の対策、現地パートナーとの責任分担の整理が考えられます。これは情報整理であり、法的助言ではありません。",
  "next_steps": "資料によれば、意見募集文書は2026年10月8日から1か月以内（2026年11月頃まで）に公表される予定です。その後に法案化や施行に至る日程は資料に書かれていません。文書公表後に意見募集と法制化の議論が進むというのは推測です。",
  "unknowns": [
    "意見募集が公開で行われるのか、選ばれた関係者に限られるのか（本文でも不明とされています）",
    "新法を制定するのか、既存法の活用や規則で対応するのかの最終的な方針",
    "規制の対象範囲、義務の内容、罰則の有無",
    "法律や規則の施行日や提出時期",
    "文書で提示される業界責任の具体的な中身"
  ],
  "glossary": [
    {
      "term": "MeitY",
      "explanation": "インドの電子情報技術省です。インドのIT・デジタル政策やAI政策を所管しています。"
    },
    {
      "term": "意見募集文書（コンサルテーション・ペーパー）",
      "explanation": "政策や規制の案を示し、関係者から意見を集めるための文書です。"
    },
    {
      "term": "techno-legal solutions",
      "explanation": "法律による規制だけでなく、技術的な仕組みも組み合わせて課題に対処する考え方です。"
    },
    {
      "term": "DPDP法",
      "explanation": "Digital Personal Data Protection Act。インドの個人データ保護法で、本文では既存法による対応の例として挙げられています。"
    },
    {
      "term": "AIGEG",
      "explanation": "AI Governance and Economic Group。2026年4月に設置された、AI政策を調整する中央の機関です。"
    }
  ]
}
