{
  "id": "2026-09-14-cn-001",
  "status": "published",
  "model": "claude-sonnet-5-5",
  "created_at": "2026-10-10T11:25:16Z",
  "record_id": "2026-09-14-cn-001",
  "source_kind": "official",
  "published_at": "2026-10-10T11:25:16Z",
  "headline": "中国の網安標委、AI安全ガバナンス枠組み3.0を発表",
  "lead": "2026年9月14日、中国の全国ネットワーク安全標準化技術委員会（網安標委）が「人工知能安全ガバナンスフレームワーク3.0」を発表しました。2024年の1.0、2025年の2.0に続く更新版で、リスク分類の見直しと、技術的対応・総合ガバナンス措置の調整が行われたとされています。本文から確認できるのは公表の事実と概要で、義務や罰則に関する記載はありません。",
  "facts": [
    {
      "text": "網安標委は、2026年9月14日の国家ネットワーク安全宣伝週間の開幕式で、「人工知能安全ガバナンスフレームワーク3.0」を発表しました。",
      "source_url": "https://www.cac.gov.cn/2026-09/14/c_1791137092283345.htm"
    },
    {
      "text": "網安標委は『グローバルAIガバナンス・イニシアティブ』の実施として、2024年に1.0、2025年に2.0を発表しており、今回の3.0はそれに続くものです。",
      "source_url": "https://www.cac.gov.cn/2026-09/14/c_1791137092283345.htm"
    },
    {
      "text": "3.0は、国家インターネット情報弁公室の指導のもと、網安標委が中国網絡空間研究院、同弁公室のデータ・技術保障センターなどの専門機関、研究機関、業界企業を組織して策定しました。",
      "source_url": "https://www.cac.gov.cn/2026-09/14/c_1791137092283345.htm"
    },
    {
      "text": "3.0は「リスク分類、技術的対応、総合ガバナンス」という中核的な考え方を引き継いでいます。",
      "source_url": "https://www.cac.gov.cn/2026-09/14/c_1791137092283345.htm"
    },
    {
      "text": "3.0ではリスク分類が更新され、技術的対応と総合ガバナンスの措置も調整されました。目的は、AI安全ガバナンスに関する共通認識とリスク対応能力の向上だと説明されています。",
      "source_url": "https://www.cac.gov.cn/2026-09/14/c_1791137092283345.htm"
    }
  ],
  "who_is_affected": "中国でAIを開発・提供する企業や研究機関が、安全対策の参照先として関係する可能性があります。ただし、本文には適用対象や拘束力の記載がないため、どの事業者にどの程度の影響があるかは断定できません。",
  "japan_impact": "中国向けにAIサービスを提供する日本企業、中国に開発・運用拠点を持つ企業、中国のAI事業者と取引する企業は、3.0の内容、特にリスク分類の変更点を確認する価値があると考えられます。自社のAIリスク管理の項目と照らし合わせることも一案です。本文は公表の概要のみで、PDF全文は今回の資料に含まれていないため、実務上の判断には原文の確認が必要です。法的助言ではありません。",
  "next_steps": "施行日や今後の予定は、資料に書かれていません。推測ですが、今後は関連する標準や運用指針への反映が行われるかが注目点になります。まずは公式サイトに掲載された3.0の全文の確認が出発点になります。",
  "unknowns": [
    "3.0が法的拘束力を持つのか、推奨的な指針なのか",
    "リスク分類の具体的な変更内容と、技術的対応・総合ガバナンス措置の中身",
    "適用対象の範囲（外国企業や中国国外から提供されるサービスを含むか）",
    "違反時の罰則や監督の有無",
    "施行日や適用開始時期、今後の改訂・関連標準の予定"
  ],
  "glossary": [
    {
      "term": "網安標委（全国ネットワーク安全標準化技術委員会）",
      "explanation": "中国のネットワーク安全分野の標準化を担う技術委員会です。本件の3.0を発表しました。"
    },
    {
      "term": "国家インターネット情報弁公室（CAC）",
      "explanation": "中国のインターネット関連の管理を担う機関です。本件では3.0の策定を指導した立場とされています。"
    },
    {
      "term": "AI安全ガバナンスフレームワーク",
      "explanation": "AIのリスクを分類し、技術面と制度面の対応を整理した枠組み文書です。本文からは法令そのものとは読み取れません。"
    }
  ]
}
