{
  "id": "2026-10-30-kr-001",
  "status": "published",
  "model": "claude-sonnet-5-5",
  "created_at": "2026-10-31T01:02:47Z",
  "record_id": "2026-10-30-kr-001",
  "source_kind": "official",
  "published_at": "2026-10-31T01:02:47Z",
  "headline": "韓国MSIT、フィジカルAI産業育成で専門家との対話を推進",
  "lead": "韓国の科学技術情報通信部（MSIT）は、国内のフィジカルAI産業の育成を速めるため、専門家との意思疎通を進めると発表しました。出典ページに載っているのは題名と担当部署で、詳しい内容は添付ファイルにあります。規制や義務を定める発表かどうかは、本文からは確認できません。",
  "facts": [
    {
      "text": "MSITは「国内の物理的人工知能（フィジカルAI）産業の育成を速めるための専門家との意思疎通を進める」という題名の報道資料を公表しました。",
      "source_url": "https://www.msit.go.kr/bbs/view.do?sCode=user&bbsSeqNo=94&nttSeqNo=3187900"
    },
    {
      "text": "担当部署はMSITのデバイスAX革新チームで、担当者は尹洪俊（ユン・ホンジュン）事務官と記載されています。",
      "source_url": "https://www.msit.go.kr/bbs/view.do?sCode=user&bbsSeqNo=94&nttSeqNo=3187900"
    },
    {
      "text": "ページ本文は報道資料の内容として、詳細は添付ファイルを参照するよう案内しています。",
      "source_url": "https://www.msit.go.kr/bbs/view.do?sCode=user&bbsSeqNo=94&nttSeqNo=3187900"
    },
    {
      "text": "添付ファイルは「261030」で始まる名称のhwpx形式で、ファイル名に「朝刊（報道）」と記されています。",
      "source_url": "https://www.msit.go.kr/bbs/view.do?sCode=user&bbsSeqNo=94&nttSeqNo=3187900"
    }
  ],
  "who_is_affected": "現時点で、特定の企業に義務を課す内容は確認できません。ロボットや製造分野でフィジカルAIを開発する企業や、韓国で事業を行う企業は、今後の施策の対象になる場合があります。",
  "japan_impact": "日本企業への直接の義務は、本文からは読み取れません。韓国でフィジカルAIの事業や共同開発を考える企業は、MSITの動きを確認するとよいでしょう。韓国の取引先や拠点がある場合は、支援策や意見交換の機会が設けられるか見ておくとよいでしょう。",
  "next_steps": "今後の予定は、本文には書かれていません。意見交換の日時や参加者も確認できません。推測ですが、添付ファイルに具体的な進め方が載っている可能性があります。原文の添付資料を確認するとよいでしょう。",
  "unknowns": [
    "専門家との意見交換の日時、形式、参加者",
    "対話の結果が支援策や規制にどうつながるか",
    "支援の対象となる企業や分野の範囲",
    "法的な義務や罰則を伴うかどうか",
    "外国企業が参加や支援の対象になるかどうか",
    "添付ファイルの具体的な内容"
  ],
  "glossary": [
    {
      "term": "フィジカルAI",
      "explanation": "ロボットや機械など、現実の物理世界で動く装置にAIを組み込む分野です。出典では「物理的人工知能」とも表記されています。"
    },
    {
      "term": "MSIT",
      "explanation": "韓国の科学技術情報通信部（과학기술정보통신부）の英語略称です。科学技術とAI、情報通信の政策を担当する省庁です。"
    }
  ]
}
