{
  "id": "2026-07-16-kh-001",
  "status": "published",
  "model": "claude-sonnet-5-5",
  "created_at": "2026-10-10T11:30:49Z",
  "record_id": "2026-07-16-kh-001",
  "source_kind": "official",
  "published_at": "2026-10-10T11:30:49Z",
  "headline": "カンボジア、世界AI協力機構(WAICO)の設立協定に署名",
  "lead": "2026年7月16日、カンボジア郵政通信省のChea Vandeth大臣が、政府の承認を受けて世界人工知能協力機構(WAICO)の設立協定に署名しました。署名の場には29カ国の代表と、国連事務総長を含む国際機関の代表が出席したと、同省は伝えています。資料から読み取れるのは国際協力の枠組みへの参加であり、企業への義務を定めた内容は本文には見当たりません。",
  "facts": [
    {
      "text": "2026年7月16日、カンボジアのChea Vandeth郵政通信大臣が、カンボジア王国政府の承認を受け、世界人工知能協力機構(WAICO)の設立協定に署名しました。",
      "source_url": "https://mptc.gov.kh/en/2026/07/minister-chea-vandeth-represents-cambodia-as-a-signatory-to-the-agreement-on-the-establishment-of-the-world-artificial-intelligence-cooperation-organization/"
    },
    {
      "text": "同省の記事は、署名の場に29カ国の代表と国際機関の代表が出席し、国連事務総長のアントニオ・グテーレス氏も含まれていたと伝えています。",
      "source_url": "https://mptc.gov.kh/en/2026/07/minister-chea-vandeth-represents-cambodia-as-a-signatory-to-the-agreement-on-the-establishment-of-the-world-artificial-intelligence-cooperation-organization/"
    },
    {
      "text": "記事の冒頭には開催地として上海が示されています。",
      "source_url": "https://mptc.gov.kh/en/2026/07/minister-chea-vandeth-represents-cambodia-as-a-signatory-to-the-agreement-on-the-establishment-of-the-world-artificial-intelligence-cooperation-organization/"
    },
    {
      "text": "WAICOは、AIのイノベーション・開発・展開・活用を共通の進歩と公益のために促進することを目的の一つとしています。",
      "source_url": "https://mptc.gov.kh/en/2026/07/minister-chea-vandeth-represents-cambodia-as-a-signatory-to-the-agreement-on-the-establishment-of-the-world-artificial-intelligence-cooperation-organization/"
    },
    {
      "text": "WAICOの目的には、AIに関する国際協力の拡大、AI格差の是正、AIに伴うリスクや課題への共同対処も挙げられています。",
      "source_url": "https://mptc.gov.kh/en/2026/07/minister-chea-vandeth-represents-cambodia-as-a-signatory-to-the-agreement-on-the-establishment-of-the-world-artificial-intelligence-cooperation-organization/"
    }
  ],
  "who_is_affected": "現時点では、カンボジアのAI政策や国際協力に関わる政府機関が中心になると考えられます。資料には企業に対する義務や規制の記載がないため、民間企業への直接の影響は限定的とみられます。ただし、今後この枠組みで基準づくりや協力事業が進めば、カンボジアでAI関連事業を行う企業やデジタル分野の支援事業に関わる企業が関係してくる可能性があります。",
  "japan_impact": "今回の資料だけでは、日本企業に新たな法的義務が生じるとは読み取れません。カンボジアに拠点や顧客、取引先を持つ企業は、同国のAI関連政策の動きとして情報を把握しておく程度で足りると考えられます。WAICOの具体的な活動内容や、日本が参加しているかどうかは本文からは分からないため、公式情報で確認する必要があります。なお、本稿は情報整理であり、法的助言ではありません。",
  "next_steps": "資料には、協定の発効時期や今後の活動計画、加盟手続きなどの予定は書かれていません。そのため、今後の見通しは示せません。推測ですが、協定の内容や機構の運営方針が公表された段階で、企業に関わる論点があるか確認できるようになると思われます。",
  "unknowns": [
    "協定の発効日や、各国の批准手続きの有無",
    "WAICOの組織構造、事務局の所在地、運営の仕組み",
    "署名した29カ国の具体的な国名と、日本の参加状況",
    "協定が加盟国や民間企業に義務や罰則を課すかどうか",
    "WAICOが今後どのような基準・ガイドライン・事業を作るのか"
  ],
  "glossary": [
    {
      "term": "WAICO(世界人工知能協力機構)",
      "explanation": "AIの活用促進や国際協力、AI格差の是正、リスクへの共同対処を目的として設立される国際的な機関です。今回、その設立協定に署名が行われました。"
    },
    {
      "term": "AI格差",
      "explanation": "国や地域によってAIの技術や活用機会に差があることを指します。資料ではWAICOが是正を目指す課題の一つとされています。"
    }
  ]
}
