{
  "id": "2026-07-14-jp-001",
  "status": "published",
  "model": "claude-sonnet-5-5",
  "created_at": "2026-10-10T11:30:49Z",
  "record_id": "2026-07-14-jp-001",
  "source_kind": "official",
  "published_at": "2026-10-10T11:30:49Z",
  "headline": "内閣府、人工知能基本計画の本文と概要を公表",
  "lead": "内閣府は、令和8年（2026年）7月14日に閣議決定された「人工知能基本計画」の本文と概要資料を、英訳つきで公表しました。ただし、今回確認できた出典ページは資料へのリンク集で、計画の中身までは本文に書かれていません。計画の具体的な内容は、PDFで確認する必要があります。",
  "facts": [
    {
      "text": "人工知能基本計画は、令和8年7月14日に閣議決定されました。",
      "source_url": "https://www8.cao.go.jp/cstp/ai/ai_plan/ai_plan.html"
    },
    {
      "text": "内閣府のページでは、人工知能基本計画の概要と本文がPDFで公開され、それぞれに英訳も用意されています。",
      "source_url": "https://www8.cao.go.jp/cstp/ai/ai_plan/ai_plan.html"
    },
    {
      "text": "同じページには、過去の人工知能基本計画として、令和7年12月23日に閣議決定されたものの概要と本文（英訳つき）も掲載されています。",
      "source_url": "https://www8.cao.go.jp/cstp/ai/ai_plan/ai_plan.html"
    },
    {
      "text": "同ページには、2025年2月4日のAI戦略会議・AI制度研究会による中間とりまとめや、2019年以降の各年のAI戦略関連資料も並んでいます。",
      "source_url": "https://www8.cao.go.jp/cstp/ai/ai_plan/ai_plan.html"
    }
  ],
  "who_is_affected": "出典ページからは、特定の事業者に課される義務は読み取れません。一般に基本計画は国の施策の方向性を示すものなので、AIの研究開発や活用に関わる事業者が、今後の国の施策や支援の動向を知るうえで参照する資料になる可能性があります。",
  "japan_impact": "今回の公表だけでは、日本企業に新たな義務が生じるかどうかは分かりません。まずは計画本文と概要を読み、自社のAI開発・提供・利用に関わる記載があるか確認するのが現実的です。海外向けにAIサービスを提供する企業や海外拠点を持つ企業は、英訳版を社内や取引先との共有に使えます。令和7年12月の計画からどこが変わったかも、見ておく価値があります。",
  "next_steps": "出典ページには、今後の予定（施行や追加のガイドライン等）に関する記載はありません。推測ですが、計画に沿って関係省庁の施策や指針が順次示される可能性があるため、内閣府のAI戦略ページや関係省庁の発表を継続して確認するとよいでしょう。",
  "unknowns": [
    "計画本文・概要の具体的な内容（目標、施策、予算など）",
    "計画が民間事業者に直接の義務や罰則を伴うかどうか",
    "令和7年12月23日の計画から何が改定されたのか",
    "今後のガイドラインや追加施策の時期・内容"
  ],
  "glossary": [
    {
      "term": "閣議決定",
      "explanation": "内閣の会議（閣議）で政府としての方針を正式に決めることです。この決定自体は、通常の法律のように事業者へ直接義務を課すものとは限りません。"
    },
    {
      "term": "人工知能基本計画",
      "explanation": "政府がAI分野の施策の方向性をまとめた計画です。今回の出典ページには、計画の概要と本文がPDFで公開されています。"
    }
  ]
}
