{
  "id": "2026-09-09-au-001",
  "status": "published",
  "model": "claude-sonnet-5-5",
  "created_at": "2026-10-10T11:25:16Z",
  "record_id": "2026-09-09-au-001",
  "source_kind": "official",
  "published_at": "2026-10-10T11:25:16Z",
  "headline": "豪首相、デジタル注意義務法案の公開草案に言及",
  "lead": "オーストラリアのアルバニージー首相は2026年9月9日のテレビインタビューで、「デジタル注意義務（Digital Duty of Care）」法案の公開草案を前日に公表したと述べました。草案は、利用者が中毒性のあるアルゴリズムをオプトアウトできる仕組みを含むと説明されています。出典は首相府が公開したインタビューの書き起こしで、法案本文ではありません。",
  "facts": [
    {
      "text": "アルバニージー首相は2026年9月9日のインタビューで、法案の公開草案（exposure draft）を「昨日」公表したと述べました。",
      "source_url": "https://www.pm.gov.au/media/television-interview-today-13"
    },
    {
      "text": "首相は「My Feed, My Way」計画について、アルゴリズムを使い続けたい人は続けられ、オプトアウトしたい人はそうできる仕組みだと説明しました。",
      "source_url": "https://www.pm.gov.au/media/television-interview-today-13"
    },
    {
      "text": "首相は、チャットボットが若い女性に1日600カロリーでの生活を助言する例を挙げ、こうした行為が起きないようにしたいと述べました。",
      "source_url": "https://www.pm.gov.au/media/television-interview-today-13"
    },
    {
      "text": "野党連合は、有害コンテンツか否かを判断する権限を通信大臣が持つ点を懸念していると、司会者が指摘しました。",
      "source_url": "https://www.pm.gov.au/media/television-interview-today-13"
    },
    {
      "text": "首相は、eSafety Commissionerが助言を行い、関連する決定は議会が無効にできる（disallowable）ものになると述べました。",
      "source_url": "https://www.pm.gov.au/media/television-interview-today-13"
    },
    {
      "text": "首相は、法案が議会全体の支持を得て成立することを望むと述べました。",
      "source_url": "https://www.pm.gov.au/media/television-interview-today-13"
    }
  ],
  "who_is_affected": "オーストラリアの利用者向けに推薦アルゴリズム付きのSNSやAIチャットボットを提供する事業者が対象になる可能性があります。ただし、対象範囲は今回の資料からは確認できません。",
  "japan_impact": "日本企業でも、オーストラリアの利用者にフィードの推薦機能やチャットボットを提供している場合は、影響を受ける可能性があります。まず自社サービスの提供先に同国が含まれるかを確認し、アルゴリズムの利用停止（オプトアウト）機能の有無と、チャットボットの健康に関わる出力への対策状況を点検しておくとよいでしょう。公開草案の本文が出た段階で、対象や義務の内容を確認する必要があります。これは情報整理であり、法的助言ではありません。",
  "next_steps": "資料には、今後の議会審議の日程や施行日の記載はありません。首相は議会全体の支持を得て成立させたい意向を示しています。推測ですが、公開草案への意見募集などを経て内容が変わる可能性があります。",
  "unknowns": [
    "法案の対象となる事業者の範囲や規模の基準",
    "違反した場合の罰則や執行の仕組み",
    "有害コンテンツの具体的な定義",
    "議会への提出時期と施行日",
    "意見募集（コンサルテーション）の期間",
    "海外事業者への適用の有無"
  ],
  "glossary": [
    {
      "term": "デジタル注意義務（Digital Duty of Care）",
      "explanation": "オンラインサービスの提供者に、利用者への害を防ぐ注意を求める考え方です。今回は法案の名称として使われています。"
    },
    {
      "term": "オプトアウト",
      "explanation": "利用者が、特定の機能やデータの利用から自分を外すよう選べることです。"
    },
    {
      "term": "公開草案（exposure draft）",
      "explanation": "正式な法案提出の前に公表され、意見を求めるための草案です。"
    },
    {
      "term": "eSafety Commissioner",
      "explanation": "オーストラリアでオンライン上の安全を担当する公的な機関の長です。今回は助言を行う役割として言及されました。"
    }
  ]
}
