{
  "id": "2026-10-23-ca-001",
  "status": "published",
  "model": "claude-sonnet-5-5",
  "created_at": "2026-10-24T09:01:11Z",
  "record_id": "2026-10-23-ca-001",
  "source_kind": "official",
  "published_at": "2026-10-24T09:01:11Z",
  "headline": "カナダOPC、AI透明性協議への意見書を公表",
  "lead": "カナダのプライバシーコミッショナー事務局（OPC）は、2026年10月23日にAI透明性協議への意見書を公表しました。イノベーション・科学・経済開発省（ISED）の討議文書に対する回答です。OPCは、ISEDが挙げた5領域で透明性の課題が生じうるという認識に同意しました。",
  "facts": [
    {
      "text": "OPCは2026年10月23日に、ISEDの討議文書「Enhancing trust in artificial intelligence (AI) through increased transparency」への意見書を公表しました。",
      "source_url": "https://www.priv.gc.ca/en/opc-news/news-and-announcements/2026/nr-c_261023/"
    },
    {
      "text": "OPCは、ISEDが示した5領域で透明性の課題が生じうることに同意しました。",
      "source_url": "https://www.priv.gc.ca/en/opc-news/news-and-announcements/2026/nr-c_261023/"
    },
    {
      "text": "5領域は、AI生成コンテンツ、AIとの対話、AIシステムに関する情報、AIインシデント、AIエージェントです。",
      "source_url": "https://www.priv.gc.ca/en/opc-news/news-and-announcements/2026/nr-c_261023/"
    },
    {
      "text": "OPCは、これらの領域に対応することが責任あるイノベーションを確かなものにし、進める上での重要な一歩になると述べました。",
      "source_url": "https://www.priv.gc.ca/en/opc-news/news-and-announcements/2026/nr-c_261023/"
    },
    {
      "text": "OPCは、討議文書が2025年のG7データ保護・プライバシー当局円卓会議の声明と同じ趣旨だと指摘しました。",
      "source_url": "https://www.priv.gc.ca/en/opc-news/news-and-announcements/2026/nr-c_261023/"
    },
    {
      "text": "その趣旨とは、AIへの国民の信頼を築くうえで透明性が欠かせないという点です。",
      "source_url": "https://www.priv.gc.ca/en/opc-news/news-and-announcements/2026/nr-c_261023/"
    }
  ],
  "who_is_affected": "今回の発表は意見書の公表であり、特定の企業に義務を課すものではありません。ただし将来、AI生成コンテンツやAIエージェントを提供する事業者に、透明性の対応が求められる場合があります。カナダ向けにAIサービスを出す企業は、動向を見ておくとよいでしょう。",
  "japan_impact": "現時点で、日本企業に新たな義務は生じていません。カナダ向けにAIサービスを提供する企業は、5領域に自社の機能が当てはまるかを確認するとよいでしょう。例えば、AI生成物の表示、AIと対話していることの告知、インシデントの情報開示の現状です。カナダの取引先や拠点がある場合は、現地の担当者と情報を共有しておくとよいでしょう。",
  "next_steps": "資料には、今後の予定や施行日の記載がありません。以下は推測です。ISEDが協議の結果を踏まえ、透明性に関する方針や制度を検討する可能性があります。ISEDの発表とOPCの意見書を、継続して確認するとよいでしょう。",
  "unknowns": [
    "ISEDが今後どのような透明性要件を定めるか",
    "法制化や指針の策定時期",
    "要件が課される対象事業者の範囲",
    "違反時の罰則の有無",
    "意見書の詳細な提言内容（本文は公表の概要のみ）"
  ],
  "glossary": [
    {
      "term": "OPC",
      "explanation": "カナダプライバシーコミッショナー事務局です。プライバシー権の保護と促進を任務とする、議会の機関です。"
    },
    {
      "term": "ISED",
      "explanation": "カナダのイノベーション・科学・経済開発省です。AI透明性に関する討議文書を出しました。"
    },
    {
      "term": "AIエージェント",
      "explanation": "今回の5領域の一つです。資料には詳しい定義がありません。"
    },
    {
      "term": "AIインシデント",
      "explanation": "今回の5領域の一つです。資料には詳しい定義がありません。"
    }
  ]
}
