{
  "id": "2026-09-23-kr-001",
  "status": "published",
  "model": "claude-sonnet-5-5",
  "created_at": "2026-10-10T11:19:58Z",
  "record_id": "2026-09-23-kr-001",
  "source_kind": "official",
  "published_at": "2026-10-10T11:19:58Z",
  "headline": "韓国個人情報委、エージェント型AIの規律を議論",
  "lead": "韓国の個人情報保護委員会は2026年9月23日、官民の政策協議会（2期）の第2回全体会議を開き、エージェント型AIの個人情報保護上の課題と制度革新の方向性を議論しました。議論の結果は、同年末に公開予定の「エージェント型AI個人情報処理ガイドライン（仮称）」と制度革新案に反映される予定です。法的な義務を新たに定めたものではなく、検討段階の動きです。",
  "facts": [
    {
      "text": "個人情報保護委員会は2026年9月23日に、「人工知能（AI）プライバシー官民政策協議会（2期）」の第2回全体会議を開きました。",
      "source_url": "https://www.pipc.go.kr/np/cop/bbs/selectBoardArticle.do?bbsId=BS074&mCode=C020010000&nttId=12527"
    },
    {
      "text": "2026年7月から8月に、国内外のAI開発・導入機関15カ所へ現場インタビューを行い、その結果が会議で報告されました。",
      "source_url": "https://www.pipc.go.kr/np/cop/bbs/selectBoardArticle.do?bbsId=BS074&mCode=C020010000&nttId=12527"
    },
    {
      "text": "インタビューに応じた機関は、プロンプトインジェクションや、エージェント型AIに与えられる過度な権限を主なリスク要因に挙げました。",
      "source_url": "https://www.pipc.go.kr/np/cop/bbs/selectBoardArticle.do?bbsId=BS074&mCode=C020010000&nttId=12527"
    },
    {
      "text": "同じ機関からは、自律と承認の境界の設定、関係者ごとの地位と責任、ログやメモリなどの個人情報の保管・破棄について基準が必要だとの意見が出ました。また、今後の安内書は原則・リスクに基づく手法と技術中立性を保つべきだとの意見もありました。",
      "source_url": "https://www.pipc.go.kr/np/cop/bbs/selectBoardArticle.do?bbsId=BS074&mCode=C020010000&nttId=12527"
    },
    {
      "text": "総合討論では、AIのデータ確保・活用のための処理根拠の柔軟化、AI個人情報活用特例の合理的な運用、実質的な安全措置と責任構造の整備などを中心に意見が出ました。",
      "source_url": "https://www.pipc.go.kr/np/cop/bbs/selectBoardArticle.do?bbsId=BS074&mCode=C020010000&nttId=12527"
    },
    {
      "text": "議論結果は、委員会が年末に公開予定の「エージェント型AI個人情報処理安内書（仮称）」と制度革新方策に反映される予定です。",
      "source_url": "https://www.pipc.go.kr/np/cop/bbs/selectBoardArticle.do?bbsId=BS074&mCode=C020010000&nttId=12527"
    }
  ],
  "who_is_affected": "現時点で義務を負う主体は示されていません。ただし将来のガイドラインは、韓国で自律的に動作するエージェント型AIを開発・提供・導入する事業者や、韓国の利用者の個人情報を扱う事業者に関わる可能性があります。対象範囲は今後の文書次第です。",
  "japan_impact": "韓国向けにAIエージェント機能を提供する日本企業や、韓国拠点・取引先でエージェント型AIを使う企業は、今後のガイドラインの内容を確認する必要があるかもしれません。準備としては、エージェントに与える権限の範囲、人の承認を挟む場面、ログやメモリに残る個人情報の保管・破棄ルール、プロンプトインジェクション対策の現状を棚卸ししておくことが考えられます。これは情報整理であり、法的助言ではありません。",
  "next_steps": "資料によると、委員会は年末にエージェント型AI個人情報処理ガイドライン（仮称）と制度革新案を公開する予定です。それ以外の具体的な日程や、ガイドラインの拘束力は資料に書かれていません。推測ですが、公開後に意見募集や追加の議論が行われる可能性があります。",
  "unknowns": [
    "ガイドラインが法的拘束力を持つか、罰則と結びつくか",
    "ガイドラインの対象となる事業者や適用範囲、域外の事業者への扱い",
    "年末の公開の正確な日付",
    "ログ・メモリの保管・破棄などの具体的な基準の内容",
    "制度革新案で個人情報保護法のどの条項が変わるか"
  ],
  "glossary": [
    {
      "term": "エージェント型AI",
      "explanation": "利用者の指示を受けて、自ら判断しながら複数の作業を進めるAIです。資料では「スズ自ら課題を遂行するAI」と説明されています。"
    },
    {
      "term": "プロンプトインジェクション",
      "explanation": "AIへの入力に悪意ある命令を混ぜ、システムに意図しない動作をさせる攻撃手法です。"
    },
    {
      "term": "AI個人情報活用特例",
      "explanation": "仮名・匿名情報だけではAI開発が難しく、公益性などが認められる場合に、強化した安全措置と委員会の審議・議決を条件として、適法に収集した個人情報をAI開発に使えるようにする制度です。資料によれば、個人情報保護法改正案は2027年3月9日施行とされています。"
    }
  ]
}
