{
  "id": "2026-10-27-jp-001",
  "status": "published",
  "model": "claude-sonnet-5-5",
  "created_at": "2026-10-28T00:38:31Z",
  "record_id": "2026-10-27-jp-001",
  "source_kind": "media",
  "published_at": "2026-10-28T00:38:31Z",
  "headline": "古川デジタル相、AISIの機能強化とAI推進法の見直しを表明",
  "lead": "古川俊治デジタル相は2026年10月27日、AIの安全性を評価する政府機関AISIを視察しました。AISIの機能を強化する方針を示し、AI推進法の見直しも検討する意向を表明しました。法改正の内容や時期は、資料には書かれていません。",
  "facts": [
    {
      "text": "古川俊治デジタル相は2026年10月27日、東京都内にあるAIセーフティ・インスティテュート（AISI）を視察しました。",
      "source_url": "https://www.nikkei.com/article/DGXZQOUA271RV0X21C26A0000000/"
    },
    {
      "text": "古川氏は視察後、記者団に「AISIの機能を強化する」と話しました。",
      "source_url": "https://www.nikkei.com/article/DGXZQOUA271RV0X21C26A0000000/"
    },
    {
      "text": "記事は、AIを悪用した不正アクセスが相次いでいると伝えています。",
      "source_url": "https://www.nikkei.com/article/DGXZQOUA271RV0X21C26A0000000/"
    },
    {
      "text": "古川氏は、AI分野で先行する米国や英国と対等な立場で議論できるよう、予算と人員確保を全力で支援すると述べました。",
      "source_url": "https://www.nikkei.com/article/DGXZQOUA271RV0X21C26A0000000/"
    },
    {
      "text": "2025年に成立したAI推進法は、AIの研究開発と利活用の促進に主眼を置く法律です。",
      "source_url": "https://www.nikkei.com/article/DGXZQOUA271RV0X21C26A0000000/"
    },
    {
      "text": "政府は、AIのリスクの変化を踏まえてAI推進法を見直し、AISIの機能と体制の強化をめざすと記事は伝えています。",
      "source_url": "https://www.nikkei.com/article/DGXZQOUA271RV0X21C26A0000000/"
    }
  ],
  "who_is_affected": "現時点で、企業に新しい義務が生じたとは資料から読み取れません。AIを開発する会社や、AIを業務で使う会社は、今後の評価の動きに関係する場合があります。サイバーセキュリティに関わる事業者も、関心を持つ場合があります。",
  "japan_impact": "今回は方針の表明にとどまり、具体的な規制は示されていません。日本企業は、AI推進法の見直しの動きを継続して確認するとよいでしょう。自社のAI利用と安全対策の現状を整理しておくと、将来の要件変更に対応しやすくなります。海外にAIサービスを出す会社は、米英の動向も合わせて見るとよいでしょう。",
  "next_steps": "資料には、法見直しの時期や手順についての予定は書かれていません。政府がAI推進法の見直しとAISIの強化をめざすことは、記事に書かれています。推測ですが、今後、政府から検討の場や方針が示される可能性があります。政府の発表を確認するとよいでしょう。",
  "unknowns": [
    "AI推進法の見直しの具体的な内容",
    "見直しの時期や、法改正が行われるかどうか",
    "AISIの予算額と人員の具体的な増加規模",
    "企業に新たな義務や罰則が課されるかどうか",
    "AISIの評価の対象範囲や進め方の変更点"
  ],
  "glossary": [
    {
      "term": "AIセーフティ・インスティテュート（AISI）",
      "explanation": "AIの安全性を評価する日本の政府機関です。記事では、古川デジタル相が視察した機関として登場します。"
    },
    {
      "term": "AI推進法",
      "explanation": "2025年に成立した法律です。記事によると、AIの研究開発と利活用の促進に主眼を置いています。"
    }
  ]
}
